{
  "id": "studylife-streamdeck",
  "name": "StudyLife for Stream Deck",
  "description": "Control the StudyLife focus timer from physical Stream Deck keys: start, pause, resume and stop a session, and watch today's study status update live on a second key.",
  "developer": "lukislp",
  "repository": "https://github.com/lukislp/studylife-streamdeck",
  "homepage": "https://github.com/lukislp/studylife-streamdeck#readme",
  "requestedScopes": [
    "TimerState.Get",
    "TimerState.Save",
    "CourseGoals.GetAll",
    "Courses.GetAll",
    "Metrics.GetSummary"
  ],
  "redirectUriPattern": "http://127.0.0.1:8785/callback"
}
